{
  "$schema": "https://json-schema.org/draft/2020-12/schema",
  "$id": "https://teamarness.dev/contracts/packages/v1/manifest.schema.json",
  "$defs": {
    "packageIdentity": {
      "type": "string",
      "minLength": 3,
      "maxLength": 128,
      "pattern": "^[a-z][a-z0-9-]{0,62}(?:\\.[a-z][a-z0-9-]{0,62})+$"
    },
    "digest": { "type": "string", "pattern": "^[0-9a-f]{64}$" },
    "relativePath": { "type": "string", "pattern": "^[^/\\x00][^\\x00]*[^/\\x00]$" },
    "range": {
      "type": "object",
      "required": ["major", "minMinor", "maxMinor"],
      "properties": {
        "major": { "type": "integer", "minimum": 1, "maximum": 65535 },
        "minMinor": { "type": "integer", "minimum": 0, "maximum": 65535 },
        "maxMinor": { "type": "integer", "minimum": 0, "maximum": 65535 }
      },
      "additionalProperties": false
    },
    "sizedFile": {
      "type": "object",
      "required": ["path", "size", "sha256"],
      "properties": {
        "path": { "$ref": "#/$defs/relativePath" },
        "size": { "type": "integer", "minimum": 0, "maximum": 8388608 },
        "sha256": { "$ref": "#/$defs/digest" }
      },
      "additionalProperties": false
    }
  },
  "type": "object",
  "required": ["schemaVersion", "identity", "version", "presentation", "protocol", "backends", "ui", "capabilities"],
  "properties": {
    "schemaVersion": { "const": 1 },
    "identity": { "$ref": "#/$defs/packageIdentity" },
    "version": { "type": "string", "minLength": 5 },
    "presentation": {
      "type": "object",
      "required": ["displayName"],
      "properties": { "displayName": { "type": "string", "minLength": 1, "maxLength": 128 } },
      "additionalProperties": false
    },
    "protocol": { "$ref": "#/$defs/range" },
    "backends": {
      "type": "array",
      "minItems": 1,
      "items": {
        "type": "object",
        "required": ["target", "path", "size", "sha256"],
        "properties": {
          "target": { "type": "string", "minLength": 1 },
          "path": { "$ref": "#/$defs/relativePath" },
          "size": { "type": "integer", "minimum": 0 },
          "sha256": { "$ref": "#/$defs/digest" }
        },
        "additionalProperties": false
      }
    },
    "ui": {
      "type": "object",
      "required": ["entrypoint", "assets", "contract"],
      "properties": {
        "entrypoint": { "$ref": "#/$defs/sizedFile" },
        "assets": {
          "type": "array",
          "maxItems": 64,
          "items": {
            "type": "object",
            "required": ["path", "mediaType", "size", "sha256"],
            "properties": {
              "path": { "$ref": "#/$defs/relativePath" },
              "mediaType": { "type": "string", "minLength": 3 },
              "size": { "type": "integer", "minimum": 0, "maximum": 8388608 },
              "sha256": { "$ref": "#/$defs/digest" }
            },
            "additionalProperties": false
          }
        },
        "contract": {
          "type": "object",
          "required": ["path", "sha256"],
          "properties": {
            "path": { "$ref": "#/$defs/relativePath" },
            "sha256": { "$ref": "#/$defs/digest" }
          },
          "additionalProperties": false
        }
      },
      "additionalProperties": false
    },
    "capabilities": {
      "type": "array",
      "items": {
        "type": "object",
        "required": ["identity", "major", "minMinor", "maxMinor"],
        "properties": {
          "identity": { "$ref": "#/$defs/packageIdentity" },
          "major": { "type": "integer", "minimum": 1, "maximum": 65535 },
          "minMinor": { "type": "integer", "minimum": 0, "maximum": 65535 },
          "maxMinor": { "type": "integer", "minimum": 0, "maximum": 65535 }
        },
        "additionalProperties": false
      }
    },
    "extensions": {
      "type": "object",
      "propertyNames": { "$ref": "#/$defs/packageIdentity" }
    }
  },
  "additionalProperties": false
}
