{"schemaVersion":1,"identity":"dev.teamarness.reference","version":"1.0.0","presentation":{"displayName":"Reference"},"protocol":{"major":1,"minMinor":0,"maxMinor":0},"backends":[{"target":"aarch64-apple-darwin","path":"backend/package","size":7,"sha256":"0000000000000000000000000000000000000000000000000000000000000000"}],"ui":{"entrypoint":{"path":"ui/index.js","size":7,"sha256":"0000000000000000000000000000000000000000000000000000000000000000"},"assets":[],"contract":{"path":"ui/contract.json","sha256":"0000000000000000000000000000000000000000000000000000000000000000"}},"capabilities":[]}
